connection node_2;
connection node_1;
connect node_1a, 127.0.0.1, root, , test, $NODE_MYPORT_1;
SET SESSION wsrep_sync_wait = 0;
connection node_1;
CREATE TABLE t1 (f1 INTEGER PRIMARY KEY, f2 CHAR(1));
INSERT INTO t1 VALUES (1, 'a');
INSERT INTO t1 VALUES (2, 'a');
connection node_1;
SET DEBUG_SYNC='wsrep_before_fragment_certification SIGNAL before_fragment WAIT_FOR continue';
XA START 't';
UPDATE t1 SET f2 = 'b' WHERE f1 = 1;
SELECT * FROM t1 WHERE f1 = 2 FOR UPDATE;
f1	f2
2	a
XA END 't';
XA PREPARE 't';;
connection node_1a;
SET DEBUG_SYNC='now WAIT_FOR before_fragment';
connection node_2;
SELECT xid FROM mysql.wsrep_streaming_log;
xid
UPDATE t1 SET f2 = 'c' WHERE f1 = 2;
connection node_1;
ERROR XA102: XA_RBDEADLOCK: Transaction branch was rolled back: deadlock was detected
XA COMMIT 't';
ERROR XA102: XA_RBDEADLOCK: Transaction branch was rolled back: deadlock was detected
SET DEBUG_SYNC = 'RESET';
SELECT * FROM t1;
f1	f2
1	a
2	c
SELECT COUNT(*) FROM mysql.wsrep_streaming_log;
COUNT(*)
0
XA RECOVER;
formatID	gtrid_length	bqual_length	data
wsrep_local_bf_aborts
1
connection node_2;
SELECT * FROM t1;
f1	f2
1	a
2	c
SELECT COUNT(*) FROM mysql.wsrep_streaming_log;
COUNT(*)
0
XA RECOVER;
formatID	gtrid_length	bqual_length	data
connection node_1;
XA START 't';
INSERT INTO t1 VALUES (100, 't');
XA END 't';
XA PREPARE 't';
XA COMMIT 't';
DROP TABLE t1;
