connection node_2;
connection node_1;
connect node_1a, 127.0.0.1, root, , test, $NODE_MYPORT_1;
SET SESSION wsrep_sync_wait = 0;
connection node_1;
CREATE TABLE t1 (f1 INTEGER PRIMARY KEY, f2 CHAR(1));
INSERT INTO t1 VALUES (1, 'a');
INSERT INTO t1 VALUES (2, 'a');
connection node_1;
SET DEBUG_SYNC='trans_xa_commit_after_acquire_commit_lock SIGNAL before_commit WAIT_FOR continue';
XA START 't';
UPDATE t1 SET f2 = 'b' WHERE f1 = 1;
SELECT * FROM t1 WHERE f1 = 2 FOR UPDATE;
f1	f2
2	a
XA END 't';
XA PREPARE 't';
XA COMMIT 't';;
connection node_1a;
SET DEBUG_SYNC='now WAIT_FOR before_commit';
connection node_1a;
SET GLOBAL wsrep_provider_options = 'dbug=d,apply_monitor_slave_enter_sync';
connection node_2;
UPDATE t1 SET f2 = 'c' WHERE f1 = 2;
connection node_1a;
SET SESSION wsrep_on = 0;
SET SESSION wsrep_on = 1;
connection node_1a;
SET GLOBAL wsrep_provider_options = 'dbug=';
SET GLOBAL wsrep_provider_options = 'dbug=d,abort_trx_end';
SET GLOBAL wsrep_provider_options = 'signal=apply_monitor_slave_enter_sync';
SET SESSION wsrep_on = 0;
SET SESSION wsrep_on = 1;
SET GLOBAL wsrep_provider_options = 'dbug=';
SET GLOBAL wsrep_provider_options = 'signal=abort_trx_end';
SET DEBUG_SYNC = 'now SIGNAL continue';
SET DEBUG_SYNC = 'RESET';
connection node_1;
SELECT * FROM t1;
f1	f2
1	b
2	c
SELECT COUNT(*) FROM mysql.wsrep_streaming_log;
COUNT(*)
0
XA RECOVER;
formatID	gtrid_length	bqual_length	data
wsrep_local_bf_aborts
1
connection node_2;
SELECT * FROM t1;
f1	f2
1	b
2	c
SELECT COUNT(*) FROM mysql.wsrep_streaming_log;
COUNT(*)
0
XA RECOVER;
formatID	gtrid_length	bqual_length	data
connection node_1;
XA START 't';
INSERT INTO t1 VALUES (100, 't');
XA END 't';
XA PREPARE 't';
XA COMMIT 't';
DROP TABLE t1;
